{
  "schemaVersion": "0.1.0",
  "metadata": {
    "repository": "fixture",
    "branch": "main",
    "commit": "0123456789abcdef0123456789abcdef01234567",
    "generatedAt": "2026-05-14T12:00:00.000Z",
    "generationMode": "codex-session",
    "privacy": "local-only"
  },
  "evidence": [
    {
      "id": "ev:src/server.ts#startServer",
      "kind": "symbol",
      "path": "src/server.ts",
      "symbol": "startServer",
      "language": "typescript",
      "provenance": "typescript-ast",
      "reason": "Defines the server entrypoint."
    },
    {
      "id": "ev:src/routes.ts#routes",
      "kind": "symbol",
      "path": "src/routes.ts",
      "symbol": "routes",
      "language": "typescript",
      "provenance": "typescript-ast",
      "reason": "Defines route registration."
    }
  ],
  "nodes": [
    {
      "id": "node:server",
      "kind": "module",
      "label": "Server",
      "evidence": ["ev:src/server.ts#startServer"],
      "confidence": {
        "overall": "high"
      }
    },
    {
      "id": "node:routes",
      "kind": "module",
      "label": "Routes",
      "evidence": ["ev:src/routes.ts#routes"],
      "confidence": {
        "overall": "medium"
      },
      "uncertaintyReason": "Route behavior is inferred from registration evidence, not traced at runtime."
    }
  ],
  "edges": [
    {
      "id": "edge:server-to-routes",
      "kind": "registers",
      "from": "node:server",
      "to": "node:routes",
      "evidence": ["ev:src/server.ts#startServer", "ev:src/routes.ts#routes"],
      "confidence": {
        "overall": "medium",
        "direction": "medium"
      },
      "uncertaintyReason": "Connection is likely from registration evidence and needs human review."
    }
  ],
  "flows": [
    {
      "id": "flow:startup",
      "name": "Startup",
      "summary": "The server likely registers routes during startup.",
      "trigger": "Process startup",
      "entry": "node:server",
      "exit": "node:routes",
      "steps": [
        {
          "id": "step:register-routes",
          "order": 1,
          "node": "node:routes",
          "edge": "edge:server-to-routes",
          "description": "Likely registers routes during startup.",
          "evidence": ["ev:src/server.ts#startServer", "ev:src/routes.ts#routes"],
          "confidence": {
            "overall": "medium",
            "semantics": "medium"
          },
          "uncertaintyReason": "Relationship is inferred from registration evidence and needs human review."
        }
      ]
    }
  ],
  "diagnostics": [
    {
      "id": "diag:human-review-startup",
      "severity": "warning",
      "message": "Human review required for inferred startup route registration.",
      "evidence": ["ev:src/server.ts#startServer", "ev:src/routes.ts#routes"]
    }
  ]
}
